{
  "id": "code-reviewer",
  "name": "Code Reviewer v4",
  "blockType": "inference",
  "version": "4.0.0",
  "isAtomic": true,
  "description": "Reviews implemented code for quality, completeness, and adherence to best practices. Evaluates on 7 weighted axes (completeness, code quality, error handling, tests, conventions, architecture, security). Single LLM call with deep reasoning.",
  "inputs": [
    { "id": "implementedSteps", "type": "string", "required": true, "description": "JSON array of implemented steps with files modified" },
    { "id": "projectContext", "type": "string", "required": true, "description": "JSON object with conventions, architecture patterns" },
    { "id": "testResults", "type": "string", "required": false, "description": "JSON object with test results from the VERIFIER phase" },
    { "id": "iteration", "type": "string", "required": false, "description": "Current iteration number (0 = first pass). If > 0, previous issues must be verified as resolved." }
  ],
  "outputs": [
    { "id": "response", "type": "string", "description": "JSON object: { score, approved, axes, issues, summary }" }
  ],
  "config": {
    "systemPromptFile": "system-prompt.md",
    "model": "claude-opus-4-6",
    "temperature": 0.2,
    "maxTokens": 4000
  },
  "metadata": {
    "category": "development",
    "tags": ["review", "quality", "code", "evaluation", "v4"],
    "tier": 1
  }
}
