{
  "id": "run-model-tests",
  "name": "Run Model Tests",
  "blockType": "command",
  "version": "1.0.0",
  "description": "Executes the model capability test suite against a specified model. Returns structured test results compatible with the Knowledge Base.",
  "isAtomic": true,
  "capabilities": ["testing", "evaluation"],

  "inputs": [
    {
      "id": "modelId",
      "name": "Model ID",
      "type": "string",
      "required": true,
      "description": "HuggingFace model ID (e.g., 'deepseek-ai/DeepSeek-R1-Distill-Qwen-1.5B')"
    },
    {
      "id": "categories",
      "name": "Test Categories",
      "type": "string",
      "required": false,
      "default": "all",
      "description": "Comma-separated list of categories to test (outputFormat, instructionFollowing, contextMemory, reasoning, toolCalling, codeGeneration) or 'all'"
    },
    {
      "id": "llmProviderUrl",
      "name": "LLM Provider URL",
      "type": "string",
      "required": false,
      "default": "http://localhost:8000",
      "description": "URL of the LLM Provider API"
    }
  ],

  "outputs": [
    {
      "id": "testResults",
      "name": "Test Results",
      "type": "object",
      "description": "Complete test results following model-test-result schema"
    },
    {
      "id": "summary",
      "name": "Summary",
      "type": "object",
      "description": "Quick summary with score, classification, pass/fail counts"
    },
    {
      "id": "outputPath",
      "name": "Output File Path",
      "type": "string",
      "description": "Path where results were saved"
    }
  ],

  "config": {
    "command": "powershell.exe",
    "args": [
      "-ExecutionPolicy", "Bypass",
      "-File", "{{projectRoot}}/blocks/scripts/model-testing/test-model-capabilities.ps1",
      "-ModelId", "{{modelId}}",
      "-Categories", "{{categories}}",
      "-LLMProviderUrl", "{{llmProviderUrl}}"
    ],
    "workingDirectory": "{{projectRoot}}",
    "timeout": 600000,
    "parseOutput": "json"
  },

  "metadata": {
    "system": true,
    "category": "testing",
    "canOverride": true,
    "author": "Maestro Team",
    "documentation": "docs/knowledge-base/_schemas/model-test-result.schema.json",
    "overrideInstructions": "Clone this block to customize test execution parameters or add pre/post processing steps."
  }
}
