{
  "id": "ui-feature-developer",
  "name": "UI Feature Developer",
  "blockType": "agent",
  "version": "1.0.0",
  "isAtomic": false,
  "description": "Develops UI features by generating and integrating HTML, CSS, and TypeScript code. This is the CORRECT way to implement what Cantante's autonomous-dev.py does incorrectly as a monolithic script.",

  "inputs": [
    {
      "id": "feature",
      "name": "Feature Description",
      "type": "string",
      "required": true,
      "description": "What UI feature to implement (e.g., 'Add music player controls')"
    },
    {
      "id": "projectPath",
      "name": "Project Path",
      "type": "string",
      "required": true,
      "description": "Path to the project root directory"
    },
    {
      "id": "targetFiles",
      "name": "Target Files",
      "type": "object",
      "required": false,
      "description": "Specific files to modify (html, css, typescript paths)",
      "default": {
        "html": "src/renderer/index.html",
        "css": "src/renderer/styles.css",
        "typescript": "src/renderer/renderer.ts"
      }
    },
    {
      "id": "styleGuide",
      "name": "Style Guide",
      "type": "object",
      "required": false,
      "description": "Design tokens and style preferences",
      "default": {
        "theme": "dark",
        "accentColor": "#1DB954",
        "fontFamily": "system-ui"
      }
    }
  ],

  "outputs": [
    {
      "id": "success",
      "name": "Success",
      "type": "boolean",
      "description": "Whether all modifications were successful"
    },
    {
      "id": "filesModified",
      "name": "Files Modified",
      "type": "array",
      "description": "List of files that were modified"
    },
    {
      "id": "summary",
      "name": "Summary",
      "type": "string",
      "description": "Human-readable summary of changes"
    },
    {
      "id": "errors",
      "name": "Errors",
      "type": "array",
      "description": "Any errors that occurred"
    }
  ],

  "config": {
    "model": "deepseek-ai/deepseek-coder-1.3b-instruct",
    "maxSteps": 20,
    "maxTokens": 15000,
    "temperature": 0.3,
    "timeoutMs": 600000,
    "requireApproval": false,

    "tools": [
      "file-read",
      "file-write",
      "llm-generate",
      "code-extractor",
      "git-status",
      "git-diff"
    ],

    "systemPrompt": "Tu es un développeur UI expert. Ta tâche est d'implémenter des features UI de manière autonome.\n\n## Feature à implémenter\n{{feature}}\n\n## Fichiers cibles\n- HTML: {{targetFiles.html}}\n- CSS: {{targetFiles.css}}\n- TypeScript: {{targetFiles.typescript}}\n\n## Guide de style\n- Thème: {{styleGuide.theme}}\n- Couleur accent: {{styleGuide.accentColor}}\n\n## Processus\n1. Lire les fichiers existants avec `file-read`\n2. Générer le nouveau code avec `llm-generate`\n3. Extraire le code propre avec `code-extractor`\n4. Écrire les modifications avec `file-write`\n5. Vérifier les changements avec `git-diff`\n\n## Règles\n- Préserver le code existant\n- Ajouter des commentaires clairs\n- Suivre les conventions du projet\n- Tester la syntaxe avant d'écrire\n- Ne jamais écraser des fonctionnalités existantes",

    "subtasks": [
      {
        "id": "implement-html",
        "name": "Implement HTML",
        "description": "Add HTML structure for the feature",
        "tools": ["file-read", "llm-generate", "code-extractor", "file-write"]
      },
      {
        "id": "implement-css",
        "name": "Implement CSS",
        "description": "Add CSS styles for the feature",
        "tools": ["file-read", "llm-generate", "code-extractor", "file-write"]
      },
      {
        "id": "implement-ts",
        "name": "Implement TypeScript",
        "description": "Add TypeScript logic for the feature",
        "tools": ["file-read", "llm-generate", "code-extractor", "file-write"]
      },
      {
        "id": "validate",
        "name": "Validate Changes",
        "description": "Verify all changes are correct",
        "tools": ["git-status", "git-diff"]
      }
    ]
  },

  "capabilities": [
    "ui-development",
    "html-generation",
    "css-generation",
    "typescript-generation",
    "code-integration"
  ],

  "metadata": {
    "category": "development",
    "tags": ["agent", "ui", "frontend", "autonomous", "cantante"],
    "author": "maestro-team",
    "createdAt": "2026-01-28T00:00:00Z",
    "updatedAt": "2026-01-28T00:00:00Z",
    "status": "active",
    "description": "Refactored version of Cantante's autonomous-dev.py. Demonstrates proper Maestro agent architecture."
  }
}
