{
  "id": "git-agent",
  "name": "Git Agent",
  "blockType": "agent",
  "version": "1.0.0",
  "isAtomic": false,
  "description": "Manages git operations: staging, committing, branching, and PR creation. Uses commit-writer for message generation and pr-writer for PR descriptions.",
  "inputs": [
    {
      "id": "action",
      "name": "Action",
      "type": "string",
      "required": true,
      "description": "Git action: commit, branch, push, pr, status"
    },
    {
      "id": "workingDir",
      "name": "Working Directory",
      "type": "string",
      "required": true,
      "description": "Repository root directory"
    },
    {
      "id": "message",
      "name": "Message",
      "type": "string",
      "required": false,
      "description": "Optional commit/PR message. If not provided, auto-generated."
    },
    {
      "id": "branchName",
      "name": "Branch Name",
      "type": "string",
      "required": false,
      "description": "Branch name for branch/PR actions"
    },
    {
      "id": "files",
      "name": "Files to Stage",
      "type": "string",
      "required": false,
      "description": "Comma-separated files to stage. If not set, stages all changes."
    }
  ],
  "outputs": [
    {
      "id": "success",
      "name": "Success",
      "type": "boolean",
      "description": "Whether the git operation succeeded"
    },
    {
      "id": "result",
      "name": "Result",
      "type": "string",
      "description": "Git command output or generated message"
    },
    {
      "id": "commitHash",
      "name": "Commit Hash",
      "type": "string",
      "description": "Hash of the created commit (for commit action)"
    },
    {
      "id": "error",
      "name": "Error",
      "type": "string",
      "description": "Error message if failed"
    }
  ],
  "config": {
    "model": "HuggingFaceTB/SmolLM2-1.7B-Instruct",
    "maxIterations": 6,
    "maxTokens": 512,
    "temperature": 0.1,
    "systemPrompt": "You are a git operations agent. You perform git commands. Output ONLY JSON.\n\nTools:\n- Git command: {\"tool\":\"maestro_cli\",\"args\":{\"command\":\"run shell-execute --input command=git <args>\"}}\n- Generate commit msg: {\"tool\":\"maestro_cli\",\"args\":{\"command\":\"run commit-writer --input diff=<diff> --input status=<status>\"}}\n- Generate PR desc: {\"tool\":\"maestro_cli\",\"args\":{\"command\":\"run pr-writer --input commits=<commits> --input diffSummary=<summary>\"}}\n- Done: {\"tool\":\"done\",\"args\":{\"summary\":\"...\",\"commitHash\":\"abc123\"}}\n\nFor 'commit' action:\n1. Run: git status\n2. Run: git diff --cached (or git diff if nothing staged)\n3. Stage files: git add <files> (or git add -A)\n4. Generate commit message (commit-writer)\n5. Run: git commit -m \"<message>\"\n6. Done with commit hash\n\nFor 'branch' action:\n1. Run: git checkout -b <branchName>\n2. Done\n\nFor 'push' action:\n1. Run: git push -u origin <branch>\n2. Done\n\nFor 'status' action:\n1. Run: git status\n2. Run: git log --oneline -5\n3. Done with status\n\nRules:\n- NEVER force push. NEVER use --force.\n- ALWAYS stage specific files, not git add -A (unless explicitly asked).\n- If commit message is provided in input, use it directly.\n- If not provided, generate with commit-writer.",
    "tools": ["shell-execute", "commit-writer", "pr-writer"]
  },
  "metadata": {
    "category": "git",
    "tags": ["agent", "git", "commit", "branch", "pr"],
    "author": "maestro-v3"
  },
  "capabilities": ["git-operations", "commit", "branch", "llm", "tools"]
}
